{"event_id":"550e8400-e29b-41d4-a716-446655440002","partition_key":"600000.XSHG","provider":"SIM","instrument_id":"600000.XSHG","exchange":"XSHG","calendar_id":"CN-A","calendar_version":"cal-v1","session_id":"am","trading_day":"2026-08-11","event_time":"2026-08-11T01:30:01Z","received_at":"2026-08-11T01:30:01.001Z","source_sequence":12,"watermark_sequence":12,"last_price":"10.02","last_quantity":200,"turnover":"2004.00","bid_price":"10.01","ask_price":"10.03","quality":"GAP","gap_start_sequence":11,"gap_end_sequence":11}
